{
  "schema_version": "provider-prompt-v1",
  "positive": "Re-render this exact image from reference image 1. Lock the exact camera angle, crop, pose, hand placement at temples, hairband position, blue band colour, lighting, and background bokeh.\n\nONLY CHANGES:\n1. Replace the model with a CHILD aged 10-13 — short brown hair (NOT bald), smooth skin, no facial hair, child-proportioned face and hands in the same pose.\n2. Jersey chest mark: use the STARZ S-crest from reference image 3 (blue) — small on chest. NO JOGA wordmark on jersey, NO crown, NO GA badge.\n\nMatch hairband product geometry from reference image 2 (royal blue band, white JOGA on band):\n\nElastic athletic hairband, continuous woven loop, royal blue, matte finish, 25mm band width, ~480mm circumference, white JOGA wordmark centered on the band face. Preserve geometry, material and proportions (source: knowledge/products/hairbands.json).\n\nVIEW: kid hero on pitch, royal blue hairband with white JOGA, both hands at temples adjusting band, smiling, dark stadium bokeh — match reference image 1 exactly.",
  "negative": "adult model, bald child, facial hair, JOGA wordmark on jersey, crown badge, GA badge, adult model, bald child, facial hair, JOGA wordmark on jersey, crown badge, GA badge",
  "metadata": {
    "execution_id": "joga-hairbands-edit-subject-swap",
    "product_spec_id": "joga-hairbands-edit-subject-swap-product",
    "creative_spec_id": "joga-hairbands-edit-subject-swap-creative",
    "edit_spec_ids": [
      "joga-hairbands-edit-subject-swap-edit"
    ],
    "placeholders_resolved": {
      "view": "kid hero on pitch, royal blue hairband with white JOGA, both hands at temples adjusting band, smiling, dark stadium bokeh — match reference image 1 exactly",
      "composition": "",
      "background": "",
      "cad": "Elastic athletic hairband, continuous woven loop, royal blue, matte finish, 25mm band width, ~480mm circumference, white JOGA wordmark centered on the band face. Preserve geometry, material and proportions (source: knowledge/products/hairbands.json)."
    },
    "composition": "",
    "background": "",
    "content_hash": "3d4af6e75107da61802c8289834bab13e5477c886711dd4ce84eeba0f28045c8"
  },
  "input_assets": {
    "references": [
      "reference/parent-shot-1-base.png",
      "reference/flatlay.png",
      "reference/starz-s-crest-blue.png"
    ],
    "input_images": []
  }
}
