{
  "schema_version": "provider-prompt-v1",
  "positive": "Re-render reference image 1 in place. Lock the child, hairband, hands, pose, lighting, background and kit colours exactly.\n\nONLY CHANGES:\n1. Remove completely the Joma J element from the jersey chest.\n2. Remove completely the white swoosh element from the jersey chest.\n3. Reconstruct plain royal-blue jersey fabric with natural weave and lighting where the removed elements were.\n\nDo not crop the product. Do not alter anything else.",
  "negative": "joma_j, white_swoosh, crop_product, joma_j, white_swoosh, crop_product",
  "metadata": {
    "execution_id": "joga-hairbands-edit-remove-element",
    "product_spec_id": "joga-hairbands-edit-remove-element-product",
    "creative_spec_id": "joga-hairbands-edit-remove-element-creative",
    "edit_spec_ids": [
      "joga-hairbands-edit-remove-element-edit"
    ],
    "placeholders_resolved": {
      "operation": "remove_element",
      "composition": "",
      "background": "",
      "cad": "(no product geometry specified)"
    },
    "composition": "",
    "background": "",
    "content_hash": "ed4a9f3240e6afdb5877d21d2c525b6188cb3426335c606a8f86ec85a95ce6b8"
  },
  "input_assets": {
    "references": [
      "reference/parent-shot-1-base.png"
    ],
    "input_images": []
  }
}
